id;thinklab;date;country;city;region;likelyhood;text
398;Tokyo;06/24/2018 10:41 pm;;;;10;"First of all, I would like to give your team big thank for hosting our visit. Our group has learned many things from this visit. The THINKLab inspires me a lot in terms of the concept of your research, your attitudes towards future technology, and the attitudes towards AI in your company. One of examples of benefit from this visit is as follows: Although my background is in IT and security, I have to teach graduate students in the field of human resource and organization development. Many of my students aware of the use of AI. However, in a negative sense. What I have leaned from this visit with further information (I will also search for further information) will surely be used as one of case study in related lecture. 
Besides above example, this visit really inspires me to pull me back to research topics with focuses on IT and security related issues."
399;Tokyo;02/01/18 10:13;Taiwan;Taipei;TPE;6;Have a comfortable space for demo and discussion. However, the demo access is restricted while visiting (because the visitors have to wait for the introduction and operation by IBM staffs). It would be awesome if the visitors have a small piece of free time to  explore and operate the the demo by themselves.
400;Tokyo;06/26/2018 07:44 am;;;;8;IBM have the prestige technologies.
401;Tokyo;06/26/2018 01:48 pm;;;;7;feeling in Hitech
402;Tokyo;06/25/2018 06:24 pm;;;;10;their visions are very advanced and response to customer needs.
403;Yorktown;11/06/18 16:00;;;;10;This is the FUTURE!
404;Yorktown;02/05/18 10:53;United States;Chicago;IL;8;Open environment, dynamic, fosters creativity with an aim for actions and results. The only reason I did not rate it higher is due to the fact that I'm not sure it is appropriate for all opportunities.
405;Yorktown;09/11/18 16:28;;;;10;Peers need to be aware of opportunities to view cutting edge options.
406;Yorktown;09/11/18 16:30;;;;10;Great use of time. Outstanding presentations, demos and tours.
407;Yorktown;09/09/19 15:16;;;;10;Excellent information that needs to be shared!
408;Yorktown;02/04/18 09:34;Germany;Stuttgart;BW;10;Nice  setup, professional, simple
409;Yorktown;03/25/2020 11:09 am;;;;8;Deep Search, Generative Model..  One thing to consider: Add some correlative models to estimate different properties of the material, as an alternative to Quantum chemical or atoms stimulation. Ingesting literature should enable this relatively easily.
410;Yorktown;03/25/2020 11:18 am;;;;8;Autonomous Chemical Lab, Applied Materials Generative Models. Comments: I feel your progress of computational material designing , especially the point of integration, not only designing but also confirming the point of synthesis. Autonomous lab I also expect your model to organic materials. THANK YOU!
411;Yorktown;01/30/2019 03:17 pm;;;;10;Planning, hosting, exciting & relevant technology, open and honest discussion.
412;Yorktown;12/30/2019 02:30 pm;;;;10;Interesting information, well organized.
413;Yorktown;08/05/19 15:20;;;;10;Inspirational. Educational. Real potential to leverage.
414;Yorktown;08/05/19 15:58;;;;8;IBM is very receptive to new problems and ideas. The use cases for Quantum are still limited, as it is still early days of QC. IBM has great talent available for helping solve business problems.
415;Yorktown;12/30/2019 03:11 pm;;;;9;Combination of technical / interactive presentations and tour around the facility.
416;Yorktown;12/30/2019 03:16 pm;;;;8;Fascinating event and range of topics. Put IBM front of mind as a great innovation company which unfortunately other brands have done a better job on stealing this space.
417;Yorktown;06/24/2019 02:13 pm;;;;10;AI
418;Yorktown;11/14/2018 11:56 am;;;;10;Good food and support. Everything good all around.
419;Yorktown;12/07/18 12:25;;;;10;High end technology, GREAT TEAM!
420;Yorktown;09/28/2018 04:49 pm;;;;8;Professional, reputation, knowledge, security
421;Yorktown;11/06/18 15:09;;;;10;You are leading in Quantum and it is obvious. I would recommend this briefing to all, especially since you do not oversell the technology. Stay true to this approach.
422;Yorktown;12/30/2019 05:45 pm;;;;9;Forward looking, professional and good insights.
423;Yorktown;09/24/2018 01:51 pm;;;;10;Open and friendly.
424;Yorktown;11/14/2018 11:51 am;;;;7;Mutual legal alignment essential re: IP based on our visit 4/2017.
425;Yorktown;02/01/19 17:52;;;;8;Good content with intent to solve problems.
426;Yorktown;12/30/2019 03:21 pm;;;;9;Very comprehensive information with great level of depth in the subject matter. Would appreciate just a tad higher level overview to some of the presentations to set the stage.
427;Yorktown;12/30/2019 03:26 pm;;;;9;The concepts were presented very well.
428;Yorktown;04/15/2019 06:06 pm;;;;10;Excellent facility. Fascinating research. Outstanding breadth of presentations.
429;Yorktown;05/17/2019 10:48 am;;;;8;Good technology.
430;Yorktown;03/25/2020 10:36 am;;;;9;Great content / various topics of interest. Long day with a lot of materials. Great insights into IBM. I never knew IBM had such deep research going on.
431;Yorktown;02/06/18 09:47;United Arab Emirates;Abu Dhabi;AZ;9;Very impressive work and it was  a very welcoming visit led by knowledgeable and professional personnel.
432;Yorktown;09/23/2019 09:57 am;;;;10;Especially, the Next-Gen Dealing room was impressive.  This can be very effective method to have discussions with concrete, visible and clear goal. Thank you very much for today.
433;Yorktown;11/14/2018 02:00 pm;;;;10;Well solicited and access to experts.
434;Yorktown;11/14/2018 02:07 pm;;;;9;I thought the workshop was a great opportunity for our team to take the next step in exploring how Quantum might impact PGR. It was productive, informative and well organized.
435;Yorktown;01/15/2019 02:20 pm;;;;8;Professional approach.
436;Yorktown;01/15/2019 02:22 pm;;;;10;It's one step closer to the future. The quality of the presentation and the passion of the IBM team was incredible. Thank you for this big gift. Its a big inspiration for me and my company.
437;Yorktown;09/09/19 15:15;;;;10;Very good presentations & excellent information.
438;Yorktown;09/24/2018 01:44 pm;;;;10;Understand the full capabilities of IBM and their partners. Provide ideas for future collaboration on innovation.
439;Yorktown;04/10/19 11:15;;;;10;It has been a very collaborative and informative 2 day workshop. We should have this type of meetings more often between teams.
440;Yorktown;06/06/19 14:34;;;;10;Session was great!
441;Yorktown;12/30/2019 04:06 pm;;;;10;Open sprint and sharing of ideas.
442;Yorktown;09/19/2018 08:47 am;;;;9;Very focused discussion to solve relevant, complex problems for Visa with actionable outcomes.
443;Yorktown;03/12/19 18:43;;;;8;It was a great time for me. Discussion with Yorktown team is good for next project.
444;Yorktown;03/30/2020 12:16 pm;;;;10;Focus. Research and Process. Solid POC. Commerical usage.
445;Yorktown;03/25/2020 11:23 am;;;;9;Deep Search.
446;Yorktown;12/30/2019 02:59 pm;;;;10;Quality of the speakers and presentations focused on our needs.
447;Yorktown;03/25/2020 11:06 am;;;;7;Deep Search, Applied Materials, AI-enriched Simulation, FOC: Systems, Generative Models.
448;Yorktown;03/07/18 18:00;Japan;Tokyo;13;10;There are a lot of interesting research.
449;Yorktown;05/31/2019 06:06 pm;;;;8;Excellent presentations and speakers. Wish we had longer hands on lab visit. Wish a bit more balanced external market view.
450;Yorktown;03/08/18 12:16;Japan;Tokyo;13;9;The presentations were inspiring and really informative with regard to the overview of cutting-edge researches in IBM labs. I truly appreciate the opportunity. The only concern is that if you have researcher-level knowledge in a presented topic or have surveyed the field thoroughly in advance, the depth of content might not be sufficient as backgrounds of audiences could be somewhat diverse and the organizers and presenters would prepare content keeping such diversity in mind.
451;Yorktown;09/11/18 16:31;;;;10;Topics were relevant to our interests and goods. Great demos!
452;Yorktown;05/03/19 15:07;;;;9;Very impressive work on AI/ML especially commercial applications!
453;Yorktown;07/24/2019 03:41 pm;;;;10;Excellent overviews by IBM. We probably could have used more time at the end for open discussion and idea pitching.
454;Yorktown;07/24/2019 03:52 pm;;;;7;I've been a bit disappointed with the lack of much statistical perspective on the various scientific questions considered (there's been a lot of talk about AI and ML - not much on stats). It's hard to tell whether this is an opportunity or an impediment after just a lay long visit - time will tell!  In any case, we are grateful to IBM for the enormous effort they've put into our visit and I remain cautiously optimistic.
455;Yorktown;12/30/2019 05:04 pm;;;;9;I gained new insights in AI, Quantum Computing and how it will integrate in the future.
456;Yorktown;03/13/2018 04:03 pm;Japan;Tokyo;13;8;To feel the difference of East and West. I visited many labs around SF, at Yorktown lab I felt difference about philosophy, that was the main reason to recommend to visit there.
457;Yorktown;12/30/2019 05:44 pm;;;;8;Quite cool and interesting to see all the things IBM is evolving and defining the future of technology
458;Yorktown;05/13/2019 05:29 pm;;;;10;A lot of information about the latest technologies. At the same time very useful for our supply chain management and quality management.
459;Yorktown;08/29/2019 11:00 am;;;;8;Thank you very much for the interesting sessions.  I'd like to utilize AI, Quantum Computing into Maintenance first and then to Motion Planning in future.
460;Yorktown;08/29/2019 11:04 am;;;;8;"1. Concern-to be.  It did not give good impression for multiple troubles with projector system
2. Many good examples and it is obvious IBM has great technology - my concern is how to apply to our business other than Equip Maintenance - there are many possibilities
3. Concern is lack of real-world applications in similar industry.
4. Some presentation was very theoretical and went deep in underlying technology of AI - difficult to understand"
461;Yorktown;05/29/2019 04:45 pm;;;;10;IBM always shows us the future computer vision clearly from the hardware perspective!!!
462;Yorktown;05/29/2019 04:47 pm;;;;9;AI hardware research of IBM is quite impressive for our business applications.
463;Yorktown;05/03/19 22:51;;;;10;I am a high school student visiting during the Horizon conference (day 1 only) and absolutely loved the all the presentations I saw. I learned a lot during the conference, but the individual sessions were built in such a way that I was able to learn as the presentation went on, so although the material was getting more advanced towards the end of each session, it was built up, allowing me to understand. I also liked that IBM was to an extent dumbing down their research to make it easy for us and other corporate people to understand but still showcasing their research in a very positive light. As a student interested in entering research and academia, I would have loved to learn more about each project and have a less dumbed-down version, but I was really happy that it didn't all just go over my head.
464;Yorktown;11/28/2018 10:48 am;;;;8;Quantum! thank you.
465;Yorktown;03/25/2020 11:11 am;;;;8;Deep Search, AI-enriched simulation. Comments: Very informative and presented conclusively. Excited to try out tools available on-line plus finding applications to engage more  firmly on  Deep Search & AI-enriched simulation.
466;Yorktown;01/15/2019 02:08 pm;;;;8;interesting up to date arguments. Very good presentations.
467;Yorktown;01/15/2019 02:14 pm;;;;10;Great opportunity to get in touch with 'state of the art' technology and innovations.
468;Yorktown;03/25/2020 11:40 am;;;;10;Deep Search .
469;Yorktown;04/27/2018 07:43 pm;;;;10;It is fascinating and inspirational to see the work being done there.  I would love to visit the Melbourne Thinklab too
470;Yorktown;12/30/2019 01:29 pm;;;;9;Various opportunities for collaboration. Leading edge of technology.
471;Yorktown;06/06/19 14:34;;;;10;Excellent design of the entire space and meeting. Some of the A/V did not work, videos didn't play and volume could not be controlled.
472;Yorktown;08/07/19 22:00;;;;10;Absolutely beautiful facility.  Enables easy collaboration by teams.
473;Yorktown;01/16/2019 06:06 pm;;;;10;Quality of the topics
474;Yorktown;02/21/2019 07:27 pm;;;;8;Very interesting topics and presentation.
475;Yorktown;02/01/19 17:15;;;;10;Detailed and valuable discussion about the topics for the banks infrastructure and environment.
476;Yorktown;12/30/2019 01:18 pm;;;;10;excellent engagement from both IBM team and Mondelez.
477;Yorktown;03/25/2020 11:36 am;;;;10;Autonomous Chemical Lab, AI-enriched stimulation, Generative Models, Quantum Computing.
478;Yorktown;01/15/2019 02:11 pm;;;;10;Inspiration, new frontier! Applications on business.
479;Yorktown;06/24/2019 02:48 pm;;;;10;Shares vision in identifying solutions to solve problems.
480;Yorktown;06/24/2019 02:52 pm;;;;8;Very good research & model. See opportunities to do some POC. Many subject matter experts at the meeting.
481;Yorktown;03/25/2020 10:32 am;;;;10;Stunning display of research and technical expertise
482;Yorktown;10/15/2018 11:40 am;;;;8;The research and application of AI in financial services is the trend of the times. It is hoped that we can apply the technologies to practice leveraging IBM as soon as possible.
483;Yorktown;10/15/2018 11:42 am;;;;10;Learned great new technologies in research. Expanded my horizons.
484;Yorktown;03/30/2020 11:58 am;;;;7;Great and friendly reception and presentations. Hort's presentation needed a little more context. Would have also liked to see more diversity in the team. Overall a great day, thank you.
485;Yorktown;02/19/2019 08:08 pm;;;;8;Unique capability. Strong competence and collaboration.
486;Yorktown;02/19/2019 08:15 pm;;;;8;Great first meeting! Excited to see the final output.
487;Yorktown;11/28/2018 10:44 am;;;;9;Very interesting topics especially Cybersecurity and Cognitive Intelligence.
488;Yorktown;01/21/2019 04:43 pm;;;;9;Great content and compelling persuasion.
489;Yorktown;08/29/2019 10:59 am;;;;8;I wanted to hear the areas of research and those details. I still believe IBM Research is the brain of the world. Thank you very much for explaining AI initiatives.  When  I run into an issue of AI, I will come back and ask your help. I think you have more experts besides SMEs we had today. Since the manufacturing industry has common processes, it would be even better to have the contents of each processes powered by AI.
490;Yorktown;11/28/2018 10:30 am;;;;10;The topics covered were very interesting. Clear and professional exposure. Great hospitality.
491;Yorktown;10/19/2018 01:10 pm;;;;9;Ability to fulfill interest and needs of client. Professionalism & capabilities.
492;Yorktown;01/16/2019 06:13 pm;;;;6;Very good mix of themes and appljcability. Good and candid presenters and a very good pace.
493;Yorktown;05/07/19 14:36;;;;10;I believe the content provided a nice broad view of IBM vision and approach on emerging threats. Also, like the flow of the day and not being planted in one seat the whole day.
494;Yorktown;09/23/2019 09:58 am;;;;10;You provided us deep detailed presentations in very wide range of areas.  I could get some bigger insights and this meeting  was very fruitful.
495;Yorktown;07/24/2019 02:43 pm;;;;9;Very substantive and informative. Beautiful facility and great hospitality.
496;Yorktown;09/12/18 15:51;;;;9;High level of knowledge. Clearly very competent people with mixed skills, with a more direct pragmatic approach rather than a typical business approach. Thank you.
497;Yorktown;12/30/2019 01:52 pm;;;;9;"Topics were relevant to our business. Built the agenda to be a win/win for both parties. Expertise of the presenters was great. 
* Wish there were more breaks and a room with sunshine."
498;Yorktown;01/15/2019 02:06 pm;;;;10;Inspirational people, technology and super computer.
499;Yorktown;12/30/2019 01:22 pm;;;;9;Relevant information. Right amount of retail. Expert presentation.
500;Yorktown;04/03/18 15:47;;;;10;I'd like to recommend to our company's young engineers who are in charge of system improvement on our Quality Improvement Project for Customer. I'd like to recommend to my son who is studying Computer Science at Keio University.
501;Yorktown;09/19/2018 08:44 am;;;;10;Cutting edge research talks, presentations and demos.
502;Yorktown;05/29/2019 01:46 pm;;;;10;Very informative! Truly enjoyed the presentation on quantum computing. I've never studied the subject but I was still able to easily comprehend it.
503;Yorktown;07/24/2019 03:21 pm;;;;10;Breathe of research!
504;Yorktown;12/30/2019 01:07 pm;;;;10;The facility is very nice.  The Quantum Computing which is on production and the explanation of structure were very interested.
505;Yorktown;03/27/2019 06:34 pm;;;;9;Very beneficial executive summaries of relevant topics. Appreciate the Z Software topic. Thank you!
506;Yorktown;10/29/2018 04:21 pm;;;;8;It was a great experience to see the actual quantum computer.  I understood well IBM Research's initiatives.  It will be great if you would continue to provide us valuable research outcomes.
507;Yorktown;05/15/2019 05:21 pm;;;;10;Unique capabilities and expertise.
508;Yorktown;12/30/2019 03:05 pm;;;;7;I think its a step in the right direction. IBM is building all the necessary building blocks and I think it will be very useful for companies to accelerate their efforts to monetize some of the ML work they are doing.
509;Yorktown;03/18/2019 02:56 pm;;;;10;Excellent venue and agenda for anyone who wants a dose of what's coming next! Brilliant presenters with command of their domain. For me, excellent learning and identifying of opportunities.
510;Yorktown;03/18/2019 03:08 pm;;;;9;Very interesting research projects relevant to the current day challenges that Fidelity is trying to solve.
511;Yorktown;12/30/2019 01:05 pm;;;;8;Auto AI is the most interesting topic for me.
512;Yorktown;02/25/2019 05:50 pm;;;;9;Very productive discussion.
513;Yorktown;09/24/2018 01:50 pm;;;;10;Personable, focused, usable information, invite to collaborate new ideas.
514;Yorktown;08/29/2018 09:06 am;;;;10;"Quantum comp is a start. People can get familiar online but nothing like the Think Labs experience and discussions,
many thanks."
515;Yorktown;10/15/2018 11:13 am;;;;10;IBM is a great company! The Think Lab showcased the technology well.
516;Yorktown;10/15/2018 11:31 am;;;;8;IBM Research is committed to explore the forefront of global advanced technologies and ideas and with strong experience in applications. IBM has broken through many constraints in today's financial globalization. You are committed to technological innovation and applications for the benefit of all mankind.
517;Yorktown;10/15/2018 11:32 am;;;;8;Powerful research capabilities and labs distributed all over the world.
518;Yorktown;10/15/2018 11:35 am;;;;7;Advanced theory and technologies were introduced in a straightaway language. It helped broaden our horizons and knowledge.
519;Yorktown;03/14/2019 01:55 pm;;;;9;Very insightful. The AI presentations shared were very relevant and we had limited knowledge prior to coming here of the depth IBM of IBM’s innovations in this space.
520;Yorktown;04/15/2019 06:08 pm;;;;10;Amazing - great opportunity to learn about the work at IBM & how you touch every part of almost every business. Wonderful of all folks to share their passion.
521;Yorktown;12/30/2019 12:57 pm;;;;10;Thank you very much for explaining about brand-new technologies.  It was excellent.
522;Yorktown;04/15/2019 05:31 pm;;;;10;Extremely informative in a digestible format.
523;Yorktown;05/17/2019 10:49 am;;;;10;Perfect organization. Plenty of healthy foods. Professionalism.
524;Yorktown;06/24/2019 02:19 pm;;;;10;AI @ IBM
525;Yorktown;09/11/18 16:34;;;;10;Friendly, sharing environment. Enormously useful information for partners. Real world examples.
526;Yorktown;12/30/2019 04:41 pm;;;;9;Good quality and presentations.
527;Yorktown;12/30/2019 05:00 pm;;;;8;High level presentations. Well organized content.
528;Yorktown;06/28/2019 04:43 pm;;;;10;Thank you, very good content.
529;Yorktown;10/04/18 17:12;;;;8;It was very fruitful to have IBM's focusing area/technologies explained. I'd like to think of how we can deploy into our business.
530;Yorktown;04/10/19 10:27;;;;8;Interesting speakers. Envisioning future opportunities but also risks. Potential options to work more together.
531;Yorktown;11/14/2018 11:59 am;;;;10;The discussion was honest and casual. It was more to help the client understand rather than follow the agenda or push products. Quality of people was great!
532;Yorktown;05/03/19 17:09;;;;10;"Very inspiring and informative event; well organized and hosted"
533;Yorktown;12/30/2019 01:00 pm;;;;10;This brings me some seeds of idea to create new service & businesses.  Thank you so much for having us today.
534;Yorktown;03/30/2020 12:46 pm;;;;7;Concerned there is a significant difference between R&D and weather research being done at TWC. TWC employees are not aware or promoting think lab research such as deep thunder.
535;Yorktown;01/21/2019 05:00 pm;;;;1;"Not much engaged with Retail, especially supermarket. Too much PR for IBM, not many interesting tasks for Retail. Presentation contents are too old - for example; 2016 or 2017 made."
536;Yorktown;02/19/2019 08:21 pm;;;;8;Collaborative meeting. Couldn't see the screen totally given conf call attendees using the opposite screen that was in full view.
537;Yorktown;12/30/2019 02:34 pm;;;;9;Great inside on AI - I loved it...
538;Yorktown;12/30/2019 02:49 pm;;;;10;Great presentations and demos.
539;Yorktown;06/24/2019 02:07 pm;;;;10;Thank you.
540;Yorktown;02/25/2019 05:53 pm;;;;10;You have a lot of exciting research topics and excellent researchers.
541;Yorktown;05/13/2019 04:39 pm;;;;9;Exposure to innovation and breakthrough agenda. Good mix of short, medium, and long technical innovation.
542;Yorktown;03/18/2019 03:07 pm;;;;10;Great topics. Well organized content.
543;Yorktown;09/11/18 16:38;;;;10;Exposure to new initiatives IBM is involved provides insight for technology coming and/or in development.
544;Yorktown;12/30/2019 04:51 pm;;;;8;I like the presentation on the future of computing very much. It is always a goal to see IBM is busy with developing that will be available and useful to us. It was a lot of information. I need to level and process.
545;Yorktown;09/09/19 15:32;;;;10;The research initiatives of the IBM Research Center provides a view of future technology and the need to continue to be abreast of emerging technologies.
546;Yorktown;12/30/2019 02:40 pm;;;;10;Excellent briefing and explanations during the lab tour.
547;Yorktown;07/24/2019 02:40 pm;;;;10;Easy wifi. Good food. Smart people. Open communication and inspiring environment and displays.
548;Yorktown;05/20/2019 12:00 pm;;;;7;I would like to have more time to get into some of the details. I was not satisfied by a couple presentations that really lacked to provide reality vs hype.
549;Yorktown;11/06/18 15:12;;;;10;Clear non-hyped description of quantum computing plus ready access to tools and systems for experimentation.
550;Yorktown;11/06/18 15:58;;;;10;Great facility & effective hosts.
551;Yorktown;09/24/2019 01:25 pm;;;;8;"Fascinating - great range of topics. Put IBM in front of mind as a great innovation company which unfortunately other brands have done a better job at stealing this space (for example; Google)."
552;Yorktown;02/28/2019 05:27 pm;;;;10;Impressive! Inspirational day.
553;Yorktown;03/25/2020 10:40 am;;;;10;Really good AI / Quantum computing briefing. NLT ideas were good. The auto AI concept is intriguing.
554;Yorktown;08/07/18 21:42;;;;10;I learned quite a bit. I'm thinking about how my projects can leverage IBM solutions.
555;Yorktown;08/07/18 21:56;;;;9;The expertise of presenters. Relevance of presentation to business issues.
556;Yorktown;12/30/2019 05:26 pm;;;;8;Gained new insights that were completely new for me.
557;Yorktown;09/12/18 15:54;;;;10;Opportunity to work closely with peers from other industries. Separate hype from actual work done. Practical demos and examples. Trends in AI and state of the art technologies.
558;Yorktown;05/31/2019 06:23 pm;;;;8;Content and topics. Quantum computing and depth of knowledge.
559;Yorktown;04/10/19 11:11;;;;10;Deep engagement. Deep technical expertise. Well organized workshop.
560;Yorktown;08/07/18 22:05;;;;10;Unique perspective on the future of computing.
561;Yorktown;07/24/2019 04:00 pm;;;;10;Good experience. Got to know state of the art in several areas. A lot of emphasis on real-world use cases.
562;Yorktown;10/15/2018 11:03 am;;;;8;It is limited to meet the persons with such similar requirements. It’s definite that IBM Research inspires us. I will recommend IBM Research to relevant parties.
563;Yorktown;04/10/19 10:56;;;;10;Excellent facility, food, EVERYTHING!
564;Yorktown;11/06/18 16:06;;;;10;Excellent environment & organization of the event.
565;Yorktown;05/04/19 02:20;;;;9;The speeches and presentations were very impressive. I liked the innovation I saw and how there was a focus on the helping of society by means of this upcoming technology. It is pretty astounding the leaps made as far as AI is concerned and I think about the impact it can have specifically on medical technology and the possibilities are endless. I was glad to see that IBM is incorporating AI into medical applications already.
